{
  "task_type": "telco_churn binary prediction",
  "target_kind": "binary",
  "business_context": "Score customers by churn risk for a retention campaign.",
  "deployment_intent": "exploratory_baseline",
  "dataset_path": "{{REPO_ROOT}}/benchmarks/evals/fixtures/datasets/telco_churn.csv",
  "dataset_location": "local",
  "data_source": "external",
  "data_segments": [
    {
      "path": "{{REPO_ROOT}}/benchmarks/evals/fixtures/datasets/telco_churn.csv",
      "format": "csv",
      "file_count": 1,
      "role": "full"
    }
  ],
  "schema_files": [],
  "split_strategy": "random_stratified",
  "split_ratio": 0.2,
  "time_column": null,
  "split_column": null,
  "split_train_value": null,
  "split_test_value": null,
  "target_column": "Churn",
  "target_labels": [
    "No",
    "Yes"
  ],
  "entity_id_column": null,
  "weight_column": null,
  "primary_metric": "roc_auc",
  "report_metrics": [
    "pr_auc",
    "log_loss"
  ],
  "model_preference": "single_baseline",
  "model_space": null,
  "scale_assumption": "local_workstation",
  "notes": "Seed contract generated from benchmarks/datasets.json entry telco_churn."
}
